{
  "$schema": "https://json-schema.org/draft/2020-12/schema",
  "$id": "https://pfem.local/schemas/retention_permanent_archive_terminal_monitoring_snapshot_record.schema.json",
  "title": "PFEM Retention Permanent Archive Terminal Monitoring Snapshot Records",
  "type": "object",
  "required": [
    "retention_permanent_archive_terminal_monitoring_snapshot_record_id",
    "permanent_archive_terminal_monitoring_snapshot_kind",
    "created_time",
    "node_id",
    "retention_permanent_archive_terminal_fixity_certificate_closeout_record_id",
    "retention_permanent_archive_terminal_fixity_certificate_verification_receipt_id",
    "permanent_archive_terminal_monitoring_snapshot_state",
    "permanent_archive_terminal_monitoring_snapshot_scope",
    "permanent_archive_terminal_monitoring_snapshot_refs",
    "subject_refs",
    "basis_refs",
    "digest_algorithm",
    "permanent_archive_terminal_monitoring_snapshot_ref_digest",
    "permanent_archive_terminal_monitoring_snapshot_by_ref",
    "summary"
  ],
  "properties": {
    "retention_permanent_archive_terminal_monitoring_snapshot_record_id": {
      "type": "string"
    },
    "permanent_archive_terminal_monitoring_snapshot_kind": {
      "type": "string"
    },
    "created_time": {
      "type": "string"
    },
    "node_id": {
      "type": "string"
    },
    "retention_permanent_archive_terminal_fixity_certificate_closeout_record_id": {
      "type": "string"
    },
    "retention_permanent_archive_terminal_fixity_certificate_verification_receipt_id": {
      "type": "string"
    },
    "permanent_archive_terminal_monitoring_snapshot_state": {
      "type": "string"
    },
    "permanent_archive_terminal_monitoring_snapshot_scope": {
      "type": "string"
    },
    "permanent_archive_terminal_monitoring_snapshot_refs": {
      "type": "array"
    },
    "subject_refs": {
      "type": "array"
    },
    "basis_refs": {
      "type": "array"
    },
    "digest_algorithm": {
      "type": "string"
    },
    "permanent_archive_terminal_monitoring_snapshot_ref_digest": {
      "type": "string"
    },
    "permanent_archive_terminal_monitoring_snapshot_by_ref": {
      "type": "string"
    },
    "summary": {
      "type": "string"
    }
  },
  "additionalProperties": true
}
